{
  "schemaVersion": 2,
  "episodeId": "YT-S01-E18",
  "seriesId": "standalone",
  "seriesName": "Standalone",
  "title": "Pay, Split, and Tip in Thai — Restaurants, Taxis, and 7-Eleven",
  "topic": "money-paying-splitting",
  "level": "A1",
  "estimatedDuration": "14:00",
  "vocab": [
    {
      "id": "v-001",
      "thai": "เก็บเงิน",
      "translit": "gèp ngern",
      "english": "the bill, please (lit. 'collect money')",
      "thaiSplit": "เก็บ เงิน",
      "explanation": "เก็บเงิน is the most natural way to ask for the bill at a Thai restaurant. Literally it means 'collect the money' — you're asking the staff to come and collect what you owe. You'll usually add ด้วย and a polite particle: เก็บเงินด้วยค่ะ. The server understands instantly. This is what locals say at noodle shops, food courts, and even fancy restaurants.",
      "exampleSentences": [
        {
          "thai": "ขอเก็บเงินที่โต๊ะนี้ด้วยค่ะ",
          "translit": "khǎaw gèp ngern thîi dtó níi dûuai khâ",
          "english": "Could we have the bill at this table, please.",
          "note": "ขอ + เก็บเงิน + ที่โต๊ะนี้ (at this table). Useful when the server is across the room and you want to flag exactly where to come."
        }
      ],
      "imageRef": "img-002"
    },
    {
      "id": "v-002",
      "thai": "เช็คบิล",
      "translit": "chék-bin",
      "english": "the bill, please (loanword)",
      "thaiSplit": "เช็ค บิล",
      "explanation": "เช็คบิล is the same idea as เก็บเงิน, but it's a loanword — you can hear the English 'check' and 'bill' in there. Thais use them interchangeably, but เช็คบิล tends to feel slightly more upmarket — you'll hear it in cafes and modern restaurants more than at a street stall. Same usage pattern: add ด้วย and a polite particle.",
      "exampleSentences": [
        {
          "thai": "เช็คบิลด้วยครับ ผมรีบ",
          "translit": "chék-bin dûuai khráp phǒm rîip",
          "english": "Check, please. I'm in a hurry.",
          "note": "ผม is the male first-person 'I'. รีบ means 'to hurry'. A useful add-on if you actually need to leave fast."
        }
      ],
      "imageRef": "img-002"
    },
    {
      "id": "v-003",
      "thai": "หาร",
      "translit": "hǎan",
      "english": "to divide / split",
      "thaiSplit": "หาร",
      "explanation": "หาร is the Thai word for 'divide' — it comes straight from maths class, but Thais use it for splitting the bill too. The most common form is หารกัน — literally 'divide together' — meaning let's split it. You can also say หารครึ่ง to split in half. Younger Thais split bills more and more, but if there's a senior person at the table, they may insist on paying for everyone — and you let them.",
      "exampleSentences": [
        {
          "thai": "หารกันสามคนนะ",
          "translit": "hǎan gan sǎam khon ná",
          "english": "Let's split it three ways.",
          "note": "สามคน = three people. นะ at the end softens it into a friendly suggestion."
        }
      ],
      "imageRef": "img-003"
    },
    {
      "id": "v-004",
      "thai": "คนละ",
      "translit": "khon lá",
      "english": "per person / each",
      "thaiSplit": "คน ละ",
      "explanation": "คนละ means 'per person' or 'each'. It's how you express the per-head amount when splitting a bill. คน means 'person', and ละ means 'each' or 'per'. So คนละสองร้อย is 'two hundred each'. Pair it with หาร and you've got the whole splitting move: หารกันนะ คนละสองร้อย — 'let's split it, two hundred each'.",
      "exampleSentences": [
        {
          "thai": "คนละห้าสิบบาทพอ",
          "translit": "khon lá hâa-sìp bàat phaaw",
          "english": "Fifty baht each is enough.",
          "note": "พอ at the end means 'enough'. Useful for confirming a fair per-person amount."
        }
      ],
      "imageRef": "img-003"
    },
    {
      "id": "v-005",
      "thai": "บัตร",
      "translit": "bàt",
      "english": "card",
      "thaiSplit": "บัตร",
      "explanation": "บัตร is a card — credit card, debit card, ID card, even gift card. At a checkout the key question is รับบัตรไหม — 'do you accept card?' Most mid-range and upmarket restaurants in Thailand take cards. Small noodle stalls and street food usually don't. Always have some cash in your wallet — even in Bangkok.",
      "exampleSentences": [
        {
          "thai": "ที่นี่จ่ายบัตรได้ไหมคะ",
          "translit": "thîi-nîi jàai bàt dâai mǎi khá",
          "english": "Can I pay by card here?",
          "note": "จ่าย means 'to pay'. ได้ไหม turns it into 'can I…?' Polite and clear."
        }
      ],
      "imageRef": "img-004"
    },
    {
      "id": "v-006",
      "thai": "เงินสด",
      "translit": "ngern sòt",
      "english": "cash",
      "thaiSplit": "เงิน สด",
      "explanation": "เงินสด is 'cash'. เงิน is 'money', สด means 'fresh' — together: cash. Cash is still king at street markets, food carts, and small shops. The unwritten rule: carry small bills. If your meal costs 60 baht and you hand over a 1000-baht note, the vendor will look at you funny and probably have to walk to a neighbour to break it.",
      "exampleSentences": [
        {
          "thai": "ขอจ่ายเงินสดได้ไหมคะ",
          "translit": "khǎaw jàai ngern sòt dâai mǎi khá",
          "english": "Can I pay in cash?",
          "note": "Sometimes useful at modern restaurants where the default assumption is card or QR — this signals you'll go old-school."
        }
      ],
      "imageRef": "img-005"
    },
    {
      "id": "v-007",
      "thai": "ทอน",
      "translit": "thaawn",
      "english": "change (money returned)",
      "thaiSplit": "ทอน",
      "explanation": "ทอน is the change you get back when you've paid more than the price. The most useful version is ไม่ต้องทอน — 'no need for change' — which is how you tip a taxi driver, a motorbike rider, or a small vendor. You're letting them keep the difference. This is the standard Thai tipping move — Thais don't really tip in restaurants, but they round up like this all the time.",
      "exampleSentences": [
        {
          "thai": "ทอนเหลือยี่สิบบาทค่ะ",
          "translit": "thaawn lǔuea yîi-sìp bàat khâ",
          "english": "Twenty baht in change for you.",
          "note": "เหลือ means 'remaining'. A vendor might say this to you when handing back your change — listen for the number that comes after."
        }
      ],
      "imageRef": "img-006"
    },
    {
      "id": "v-008",
      "thai": "เก็บไว้เลย",
      "translit": "gèp wái loei",
      "english": "keep it",
      "thaiSplit": "เก็บ ไว้ เลย",
      "explanation": "เก็บไว้เลย literally means 'keep it'. It's the warmer, friendlier version of ไม่ต้องทอน. If your taxi was 95 baht and you hand over 100, you can say เก็บไว้เลย — keep it. The เลย at the end gives it a friendly, casual feel. Use it with taxi drivers, motorbike riders, hairdressers — anyone you want to tip a small amount without making a big deal of it.",
      "exampleSentences": [
        {
          "thai": "ไม่เป็นไรค่ะ เก็บไว้เลย",
          "translit": "mâi bpen rai khâ gèp wái loei",
          "english": "It's fine, keep it.",
          "note": "ไม่เป็นไร = 'it's fine / no worries'. Pairs naturally with เก็บไว้เลย to brush off the change without sounding showy."
        }
      ],
      "imageRef": "img-006"
    }
  ],
  "blocks": [
    {
      "id": "b-001",
      "mode": "hook",
      "speakerNote": "Look straight to camera. Say the Thai line naturally and quickly, then pause one beat before the English appears.",
      "imageRef": "img-001",
      "lines": [
        {
          "id": "l-0001",
          "lang": "th",
          "thai": "เก็บเงินด้วยค่ะ",
          "translit": "gèp ngern dûuai khâ",
          "display": "immediate",
          "spoken": true
        },
        {
          "id": "l-0002",
          "lang": "en",
          "english": "Could we have the bill, please.",
          "display": "delayed-1s",
          "spoken": false
        },
        {
          "id": "l-0003",
          "lang": "en",
          "english": "By the end of this video, you'll be able to ask for the bill, split it with friends, pay by card or cash, and tip a taxi driver — all in Thai.",
          "display": "delayed-2s",
          "spoken": true
        }
      ]
    },
    {
      "id": "b-002",
      "mode": "explain",
      "speakerNote": "Pick ONE cultural fact to open with. Option A (default): PromptPay scale — over 70M accounts in a country of 70M people, even tiny street vendors have a printed QR. Option B: Service charge — most sit-down restaurants add 10%, so tipping is built in; the real tipping move is rounding up taxis and riders. Option C: Cash still king at street food and markets — carry small bills. Delete the unused options after recording.",
      "imageRef": "img-007",
      "lines": [
        {
          "id": "l-0004",
          "lang": "en",
          "english": "Thailand has over 70 million PromptPay accounts — in a country of about 70 million people. PromptPay is the QR-code payment system, and it's everywhere. Even a market lady selling 20-baht mangoes will have a QR code taped to a piece of cardboard. But here's the thing — for foreigners visiting Thailand, you mostly won't be using PromptPay. You'll be using cash, sometimes card, and you'll need to know how to ask for the bill, split it, and tip the right way. Two phrases to start:",
          "spoken": true
        },
        {
          "id": "l-0005",
          "lang": "th",
          "thai": "เก็บเงินด้วยค่ะ",
          "translit": "gèp ngern dûuai khâ",
          "spoken": true
        },
        {
          "id": "l-0006",
          "lang": "th",
          "thai": "หารกันนะ",
          "translit": "hǎan gan ná",
          "spoken": true
        },
        {
          "id": "l-0007",
          "lang": "en",